{
  "_doc": "Pedidos e-commerce — versión 2 (schema evolucionado: nuevas columnas de envío y calificación)",
  "catalog": "{catalog.bronze}",
  "schema":  "ecommerce",
  "name":    "pedidos",
  "type":    "MANAGED",
  "format":  "DELTA",
  "comment": "Pedidos de la plataforma e-commerce — schema evolucionado",
  "merge_schema": true,
  "columns": [
    {
      "name": "pedido_id",
      "type": "STRING",
      "nullable": false,
      "comment": "Identificador único del pedido"
    },
    {
      "name": "cliente_id",
      "type": "STRING",
      "nullable": false,
      "comment": "ID del cliente que realizó el pedido"
    },
    {
      "name": "email_cliente",
      "type": "STRING",
      "nullable": true,
      "comment": "Email del cliente — sensible",
      "mask": "security.mask_email"
    },
    {
      "name": "fecha_pedido",
      "type": "DATE",
      "nullable": false,
      "comment": "Fecha en que se realizó el pedido"
    },
    {
      "name": "total_usd",
      "type": "DOUBLE",
      "nullable": false,
      "comment": "Monto total del pedido en USD"
    },
    {
      "name": "estado",
      "type": "STRING",
      "nullable": false,
      "comment": "Estado: PENDING, CONFIRMED, SHIPPED, DELIVERED, CANCELLED"
    },
    {
      "name": "metodo_envio",
      "type": "STRING",
      "nullable": true,
      "comment": "Método de envío: STANDARD, EXPRESS, PICKUP — añadido en v2"
    },
    {
      "name": "dias_entrega",
      "type": "INTEGER",
      "nullable": true,
      "comment": "Días reales desde pedido hasta entrega — añadido en v2"
    },
    {
      "name": "calificacion",
      "type": "INTEGER",
      "nullable": true,
      "comment": "Calificación del cliente (1-5) — añadida en v2"
    },
    {
      "name": "cargado_en",
      "type": "TIMESTAMP",
      "comment": "Timestamp de ingesta",
      "default": "current_timestamp()"
    }
  ],
  "partitions": ["fecha_pedido"],
  "properties": {
    "delta.autoOptimize.optimizeWrite": "true"
  }
}
